{
  "$schema": "./runtime-profile.schema.json",
  "profileVersion": "RESPONSIBILITY-AUTHORITY-PROFILE-2.0.0",
  "sourceId": "SRC-P0-RESPONSIBILITY-001",
  "environment": "sandbox",
  "productionEligible": false,
  "providedBy": "SRC-P0-RESPONSIBILITY-001 controlled sandbox source owner",
  "approvedBy": "Hei",
  "approvedAt": "2026-07-31T18:51:41+08:00",
  "effectiveAt": "2026-08-01T00:00:00+08:00",
  "policyDigest": "sha256:d8d143d5a8bc7c1ebdc832953a6d5c2ca29d8c7a1739f646aedc887d2318525e",
  "bindings": {
    "feedId": "responsibility-authority",
    "partitionId": "sandbox-0",
    "consumerProjection": "responsibility",
    "version1IncrementalEndpointTemplate": "https://{environment}.responsibility-authority.sandbox.invalid/api/v1/incremental",
    "version1SnapshotEndpointTemplate": "https://{environment}.responsibility-authority.sandbox.invalid/api/v1/snapshots/{businessDate}",
    "version2IncrementalEndpointTemplate": "https://{environment}.responsibility-authority.sandbox.invalid/api/v2/incremental",
    "version2SnapshotEndpointTemplate": "https://{environment}.responsibility-authority.sandbox.invalid/api/v2/snapshots/{businessDate}",
    "maximumResponseBytes": 4194304,
    "maximumRecordsPerBatch": 1000,
    "workloadIdentityResource": "responsibility-sync-worker",
    "signatureKeyResource": "responsibility-authority-signature",
    "inboxEncryptionKeyResource": "responsibility-authority-inbox",
    "scheduleTimeZone": "Asia/Shanghai",
    "scheduleCron": "0 0 6 * * *",
    "catchUpWindowHours": 24,
    "retryBudget": 8,
    "writeContractVersion": "RESPONSIBILITY-AUTHORITY-2.0.0",
    "dualReadWindowHours": 336,
    "cutoverEnabled": true,
    "cutoverCron": "0 */15 * * * *",
    "lineageDigestProfile": "RESPONSIBILITY-LINEAGE-DIGEST-1.0.0"
  },
  "digest": "sha256:198e82c1b1cc29cb723e67593166afc9372b79f62c93c659962ed24788e96342"
}
